[
  {
    "week_ending": "2025-11-07",
    "project_key": "catalogue",
    "dpm": "Brittney Portillo",
    "status": "Green",
    "delta": "Initial setup for GitHub POC complete.",
    "milestones": "Define weekly intake process — 2025-11-07",
    "risks": "None identified.",
    "metrics": "Change",
    "next7": "Collect test updates from all DPMs.",
    "asks": "None.",
    "notes": "Test entry for project catalogue.",
    "submitted_at": "2025-11-07T09:00:00Z"
  },
  {
    "week_ending": "2025-11-07",
    "project_key": "d365",
    "dpm": "Karthik Gangadhara",
    "status": "Green",
    "delta": "Dynamics environment provisioned.",
    "milestones": "Data model mapping — 2025-11-10",
    "risks": "None.",
    "metrics": "N/A",
    "next7": "Begin connector testing.",
    "asks": "Confirm access to staging DB.",
    "notes": "Example D365 update.",
    "submitted_at": "2025-11-07T09:20:00Z"
  },
  {
    "week_ending": "2025-11-07",
    "project_key": "fulfilment",
    "dpm": "Brittney Portillo",
    "status": "Amber",
    "delta": "Integration scoping with Product Catalogue started.",
    "milestones": "Fulfilment API mapping — 2025-11-14",
    "risks": "Dependency on API documentation finalisation.",
    "metrics": "N/A",
    "next7": "Review scope with tech team.",
    "asks": "Confirm API version to integrate.",
    "notes": "Example data for fulfilment project.",
    "submitted_at": "2025-11-07T09:05:00Z"
  },
  {
    "week_ending": "2025-11-07",
    "project_key": "shopify_eu",
    "dpm": "Ant Veness",
    "status": "Green",
    "delta": "Shopify EU setup test complete.",
    "milestones": "Theme sync to EU store — 2025-11-08",
    "risks": "None currently.",
    "metrics": "Checkout conv: 2.4% (+0.3pp w/w)",
    "next7": "Start localisation testing.",
    "asks": "None.",
    "notes": "EU variant baseline entry.",
    "submitted_at": "2025-11-07T09:10:00Z"
  },
  {
    "week_ending": "2025-11-07",
    "project_key": "shopify_us",
    "dpm": "Josh Swenson",
    "status": "Amber",
    "delta": "Initial sync for multi-variant store underway.",
    "milestones": "US storefront variant test — 2025-11-09",
    "risks": "Possible overlap with EU deployment schedule.",
    "metrics": "N/A",
    "next7": "Resolve variant naming issue.",
    "asks": "None.",
    "notes": "US variant baseline entry.",
    "submitted_at": "2025-11-07T09:15:00Z"
  },
  {
    "week_ending": "2025-11-07",
    "project_key": "zendesk",
    "dpm": "Hariss Amin",
    "status": "Green",
    "delta": "Support workflow documented.",
    "milestones": "Ticket routing config — 2025-11-09",
    "risks": "Low: Waiting on final support category list.",
    "metrics": "Avg. ticket response time: 2h",
    "next7": "Pilot test with internal support team.",
    "asks": "None.",
    "notes": "Zendesk setup baseline.",
    "submitted_at": "2025-11-07T09:25:00Z"
  }
]