{
  "week_ending": "2025-10-31",
  "project_key": "zendesk",
  "dpm": "Your Name",
  "status": "Green",
  "delta": "Zendesk workflow updates deployed successfully.",
  "milestones": "Finalize ticket sync with D365 â€” 2025-11-07",
  "risks": "Potential API throttling during bulk import; monitoring in progress.",
  "metrics": "Average resolution time improved by 8%.",
  "next7": "Roll out Zendesk Guide updates to EU region; train support leads.",
  "asks": "None at this stage.",
  "notes": "All key integrations are stable and monitoring dashboards online.",
  "submitted_at": "2025-11-07T09:00:00Z"
}
