{
  "week_ending": "2025-10-30",
  "project_key": "shopify_us",
  "dpm": "Josh Swenson",
  "status": "Amber",
  "delta": "Initial sync for multi-variant store underway.",
  "milestones": "US storefront variant test â€” 2025-11-09",
  "risks": "Possible overlap with EU deployment schedule.",
  "metrics": "N/A",
  "next7": "Resolve variant naming issue.",
  "asks": "None.",
  "notes": "US variant baseline entry.",
  "submitted_at": "2025-11-07T09:15:00Z"
}
