{
  "week_ending": "2025-10-30",
  "project_key": "fulfilment",
  "dpm": "Brittney Portillo",
  "status": "Amber",
  "delta": "Integration scoping with Product Catalogue started.",
  "milestones": "Fulfilment API mapping â€” 2025-11-14",
  "risks": "Dependency on API documentation finalisation.",
  "metrics": "N/A",
  "next7": "Review scope with tech team.",
  "asks": "Confirm API version to integrate.",
  "notes": "Example data for fulfilment project.",
  "submitted_at": "2025-11-07T09:05:00Z"
}
