{
  "week_ending": "2025-10-30",
  "project_key": "catalogue",
  "dpm": "Brittney Portillo",
  "status": "Green",
  "delta": "Initial setup for GitHub POC complete.",
  "milestones": "Define weekly intake process â€” 2025-11-07",
  "risks": "None identified.",
  "metrics": "Tester",
  "next7": "Collect test updates from all DPMs.",
  "asks": "None.",
  "notes": "Test entry for project catalogue.",
  "submitted_at": "2025-11-07T09:00:00Z"
}
